conceptType,conceptUri,preferredLabel,status,skillType,reuseLevel,altLabels,description,broaderConceptUri,broaderConceptPT
KnowledgeSkillCompetence,http://data.europa.eu/esco/skill/da930e2f-6047-4616-a598-bba8ecef3039,керувати відкритими публікаціями,released,skill/competence,cross-sector,,"Знатися на методах «відкритих публікацій» (Open Publication), використанні інформаційних технологій для підтримки досліджень, на розробці інформаційних систем стосовно поточних досліджень (CRIS) і управлінні цими системами, а також на інституційних репозиторіях. Надавати консультації з питань ліцензування й авторських прав, уміти використовувати бібліометричні показники, оцінювати результати досліджень та звітувати про них.
	",http://data.europa.eu/esco/skill/98fb499f-9155-412d-a8a0-95ba97126fec,використання цифрових інструментів для співпраці й продуктивності
KnowledgeSkillCompetence,http://data.europa.eu/esco/skill/e49f4158-9d4c-425d-bf32-dfe89b19840a,планувати,released,skill/competence,transversal,,"Управляти своїми графіком і ресурсами, щоб вчасно завершити завдання.
	",http://data.europa.eu/esco/skill/66fdc34c-2326-4baa-b8ff-7a1d1015fe3a,планування й організація
KnowledgeSkillCompetence,http://data.europa.eu/esco/skill/f715be1d-5fc4-49d3-82a5-0b8090d12849,синтезувати інформацію,released,skill/competence,cross-sector,,"Аналізувати після прочитання, інтерпретувати та узагальнювати нову та складну інформацію, отриману з різних джерел.
	",http://data.europa.eu/esco/skill/9af1bd12-01bd-4d6a-947b-69e64f23150a | http://data.europa.eu/esco/skill/29dcc31e-a8d6-4a62-b3c1-2de81e966e39,обробляти якісну інформацію | збір інформації з фізичних або електронних джерел
KnowledgeSkillCompetence,http://data.europa.eu/esco/skill/f7b071bf-4882-4cfc-ae0a-7e0e0ab94c61,проводити міждисциплінарні дослідження,released,skill/competence,cross-sector,,"Опрацьовувати та використовувати результати досліджень і дані, що виходять за межі дисциплінарних та / або функціональних кордонів.\n
	",http://data.europa.eu/esco/skill/7eafec38-621a-4b6e-9298-bfe70ec0b253,проведення академічних або маркетингових досліджень
KnowledgeSkillCompetence,http://data.europa.eu/esco/skill/fa642fc3-5cc5-41cf-8926-6617a8b976a7,сприяти участі громадян у науковій та дослідницькій діяльності,released,skill/competence,cross-sector,,"Залучати громадян до наукової та дослідницької діяльності та заохочувати їхній внесок у вигляді знань, часу або вкладених ресурсів.
	",http://data.europa.eu/esco/skill/7d9bace0-63d0-4848-ac87-350a98082c12 | http://data.europa.eu/esco/skill/7eafec38-621a-4b6e-9298-bfe70ec0b253,брати активну участь у громадському житті | проведення академічних або маркетингових досліджень
KnowledgeSkillCompetence,http://data.europa.eu/esco/skill/ff64e9fc-36dd-4035-872a-83aa41dc1ad9,спілкуватися з ненауковою аудиторією,released,skill/competence,cross-sector,,"Повідомляти про наукові відкриття ненауковій аудиторії, включно з широкою громадськістю. Адаптувати наукові концепції, дебати, висновки до аудиторії, використовуючи різні методи для різних цільових груп, включно з візуальними презентаціями.\n
	",http://data.europa.eu/esco/skill/8f9f8b20-ff26-4392-b04f-695dcde5b90a,представлення дослідницької або технічної інформації
